{"contract_version":"0.1","session_id":"session_example_001","status":"partial","ai_quality":{"status":"pass","violations":[],"dimension_scores":{"goal_progression":4,"responsiveness":4,"user_agency":4,"role_believability":4,"discussion_coherence":4,"novelty_and_repetition":4,"consensus_quality":4,"natural_pacing":4}},"candidate_dimensions":[{"dimension":"issue_framing","score":3,"confidence":0.75,"evidence_message_ids":["message_001"],"positive_behavior":"例示用の観察行動。","missing_behavior":"例示用の不足行動。","improvement":"次回の具体的改善行動。","not_evaluable_reason":null,"question_results":[{"question_id":"IF01","probabilities":{"not_observed":0.05,"partially_observed":0.15,"observed":0.65,"strongly_observed":0.15},"evidence_message_ids":["message_001"]}]},{"dimension":"logical_reasoning","score":3,"confidence":0.75,"evidence_message_ids":["message_001"],"positive_behavior":"例示用の観察行動。","missing_behavior":"例示用の不足行動。","improvement":"次回の具体的改善行動。","not_evaluable_reason":null,"question_results":[{"question_id":"LR01","probabilities":{"not_observed":0.05,"partially_observed":0.15,"observed":0.65,"strongly_observed":0.15},"evidence_message_ids":["message_001"]}]},{"dimension":"listening_and_response","score":"NE","confidence":0.0,"evidence_message_ids":[],"positive_behavior":"","missing_behavior":"","improvement":"","not_evaluable_reason":{"code":"INSUFFICIENT_OPPORTUNITY","detail":"例示データでは対象行動を観察する機会がない。"},"question_results":[]},{"dimension":"valuable_contribution","score":3,"confidence":0.75,"evidence_message_ids":["message_001"],"positive_behavior":"例示用の観察行動。","missing_behavior":"例示用の不足行動。","improvement":"次回の具体的改善行動。","not_evaluable_reason":null,"question_results":[{"question_id":"VC01","probabilities":{"not_observed":0.05,"partially_observed":0.15,"observed":0.65,"strongly_observed":0.15},"evidence_message_ids":["message_001"]}]},{"dimension":"collaboration_and_relationship","score":"NE","confidence":0.0,"evidence_message_ids":[],"positive_behavior":"","missing_behavior":"","improvement":"","not_evaluable_reason":{"code":"INSUFFICIENT_OPPORTUNITY","detail":"例示データでは対象行動を観察する機会がない。"},"question_results":[]},{"dimension":"decision_and_consensus","score":"NE","confidence":0.0,"evidence_message_ids":[],"positive_behavior":"","missing_behavior":"","improvement":"","not_evaluable_reason":{"code":"INSUFFICIENT_OPPORTUNITY","detail":"例示データでは対象行動を観察する機会がない。"},"question_results":[]},{"dimension":"process_and_time_management","score":"NE","confidence":0.0,"evidence_message_ids":[],"positive_behavior":"","missing_behavior":"","improvement":"","not_evaluable_reason":{"code":"INSUFFICIENT_OPPORTUNITY","detail":"例示データでは対象行動を観察する機会がない。"},"question_results":[]}],"display_groups":{"thinking":{"score":3.0,"summary":"判断基準の提示と具体案が確認された。"},"collaboration":{"score":"NE","summary":"例示データでは評価機会が不足している。"},"progress":{"score":"NE","summary":"例示データでは評価機会が不足している。"}},"version_info":{"rubric_version":"candidate-behavior-v0.1","ai_quality_rubric_version":"ai-participant-v0.1","scenario_version":"scenario-001-v0.1","orchestrator_version":"example","prompt_version":"example","judge_model":"example","judge_version":"judge-v0.1","deterministic_evaluator_version":"deterministic-v0.1","transcript_hash":"0000000000000000example"},"review_status":"not_required","legacy_evaluation":null,"evaluation_disagreement":null}
